pub_date	year	authors	citation	category	title	venue	excerpt	url_slug	paper_url	slides_url
2022-01-01	2022	Marian Marchal, Merel Scholman, Frances Yung, Vera Demberg	Marian Marchal, Merel Scholman, Frances Yung, Vera Demberg (COLING 2022)	conferences	Establishing annotation quality in multi-label annotations	COLING	In many linguistic fields requiring annotated data, multiple interpretations of a single item are possible. Multi-label annotations more accurately reflect this possibility. However, allowing for multi-label annotations also affects the chance that two coders agree with each other. Calculating inter-coder agreement for multi-label datasets is therefore not trivial. In the current contribution, we evaluate different metrics for calculating agreement on multi-label annotations: agreement on the intersection of annotated labels, an augmented version of Cohen’s Kappa, and precision, recall and F1. We propose a bootstrapping method to obtain chance agreement for each measure, which allows us to obtain an adjusted agreement coefficient that is more interpretable. We demonstrate how various measures affect estimates of agreement on simulated datasets and present a case study of discourse relation annotations. We also show how the proportion of double labels, and the entropy of the label distribution, influences the measures outlined above and how a bootstrapped adjusted agreement can make agreement measures more comparable across datasets in multi-label scenarios.	Establishing-annotation-quality-in-multi	https://aclanthology.org/2022.coling-1.322/	
2023-01-01	2023	Frances Yung, Merel Scholman, Ekaterina Lapshinova-Koltunski, Christina Pollkläsener, Vera Demberg	Frances Yung, Merel Scholman, Ekaterina Lapshinova-Koltunski, Christina Pollkläsener, Vera Demberg (DGfS 2023)	conferences	Translation Effect on Discourse Connective Choice	DGfS		Translation-effect-on-discourse-connective	http://FrancesYung.github.io/files/SLE2020_W11.pdfDGfS_DC_alignment	
2023-01-01	2023	Nobel Varghese, Frances Yung, Kaveri Anuranjana, Vera Demberg	Nobel Varghese, Frances Yung, Kaveri Anuranjana, Vera Demberg (Workshop on Computational Approaches to Discourse@ ACL 2023)	conferences	Exploiting Knowledge about Discourse Relations for Implicit Discourse Relation Classification	Workshop on Computational Approaches to Discourse@ ACL	In discourse relation recognition, the classification labels are typically represented as one-hot vectors. However, the categories are in fact not all independent of one another on the contrary, there are several frameworks that describe the labels’ similarities (by e.g. sorting them into a hierarchy or describing them interms of features (Sanders et al., 2021)). Recently, several methods for representing the similarities between labels have been proposed (Zhang et al., 2018; Wang et al., 2018; Xiong et al., 2021). We here explore and extend the Label Confusion Model (Guo et al., 2021) for learning a representation for discourse relation labels. We explore alternative ways of informing the model about the similarities between relations, by representing relations in terms of their names (and parent category), their typical markers, or in terms of CCR features that describe the relations. Experimental results show that exploiting label similarity improves classification results.	Exploiting-knowledge-about-discourse-relation	https://aclanthology.org/2023.codi-1.13/	
2023-01-01	2023	Frances Yung, Merel Scholman, Ekaterina Lapshinova-Koltunski, Christina Pollkläsener, Vera Demberg	Frances Yung, Merel Scholman, Ekaterina Lapshinova-Koltunski, Christina Pollkläsener, Vera Demberg (SIGDIAL 2023)	conferences	Investigating Explicitation of Discourse Connectives in Translation using Automatic Annotations	SIGDIAL	Discourse relations have different patterns of marking across different languages. As a result, discourse connectives are often added, omitted, or rephrased in translation. Prior work has shown a tendency for explicitation of discourse connectives, but such work was conducted using restricted sample sizes due to difficulty of connective identification and alignment. The current study exploits automatic methods to facilitate a large-scale study of connectives in English and German parallel texts. Our results based on over 300 types and 18000 instances of aligned connectives and an empirical approach to compare the cross-lingual specificity gap provide strong evidence of the Explicitation Hypothesis. We conclude that discourse relations are indeed more explicit in translation than texts written originally in the same language. Automatic annotations allow us to carry out translation studies of discourse relations on a large scale. Our methodology using relative entropy to study the specificity of connectives also provides more fine-grained insights into translation patterns.	Investigating-explicitation-of-discourse-connective	https://aclanthology.org/2023.sigdial-1.2/	
2023-01-01	2023	Valentina Pyatkin, Frances Yung, Merel Scholman, Ido Dagan, Reut Tsarfaty, Vera Demberg	Valentina Pyatkin, Frances Yung, Merel Scholman, Ido Dagan, Reut Tsarfaty, Vera Demberg (TACL 2023)	manuscripts	Design Choices for Crowdsourcing Implicit Discourse Relations: Revealing the Biases introduced by Task Design	TACL	Disagreement in natural language annotation has mostly been studied from a perspective of biases introduced by the annotators and the annotation frameworks. Here, we propose to analyze another source of bias—task design bias, which has a particularly strong impact on crowdsourced linguistic annotations where natural language is used to elicit the interpretation of lay annotators. For this purpose we look at implicit discourse relation annotation, a task that has repeatedly been shown to be difficult due to the relations’ ambiguity. We compare the annotations of 1,200 discourse relations obtained using two distinct annotation tasks and quantify the biases of both methods across four different domains. Both methods are natural language annotation tasks designed for crowdsourcing. We show that the task design can push annotators towards certain relations and that some discourse relation senses can be better elicited with one or the other annotation approach. We also conclude that this type of bias should be taken into account when training and testing models.	Design-choices-for-crowdsourcing-implicit	https://virtual2023.aclweb.org/paper_T4803.html	
2024-01-01	2024	Frances Yung, Mansoor Ahmad, Merel Scholman, Vera Demberg	Frances Yung, Mansoor Ahmad, Merel Scholman, Vera Demberg (Linguistic Annotation Workshop @ EACL 2024)	conferences	Prompting Implicit Discourse Relation Annotation	Linguistic Annotation Workshop @ EACL	Pre-trained large language models, such as ChatGPT, archive outstanding performance in various reasoning tasks without supervised training and were found to have outperformed crowdsourcing workers. Nonetheless, ChatGPT’s performance in the task of implicit discourse relation classification, prompted by a standard multiple-choice question, is still far from satisfactory and considerably inferior to state-of-the-art supervised approaches. This work investigates several proven prompting techniques to improve ChatGPT’s recognition of discourse relations. In particular, we experimented with breaking down the classification task that involves numerous abstract labels into smaller subtasks. Nonetheless, experiment results show that the inference accuracy hardly changes even with sophisticated prompt engineering, suggesting that implicit discourse relation classification is not yet resolvable under zero-shot or few-shot settings.	Prompting-implicit-discourse-relation	https://aclanthology.org/2024.law-1.pdf#page=162	
2024-01-01	2024	Frances Yung, Merel Scholman, Šárka Zikánová, Vera Demberg	Frances Yung, Merel Scholman, Šárka Zikánová, Vera Demberg (LREC-COLING 2024)	conferences	DiscoGeM 2.0: A Parallel Corpus of English, German, French and Czech Implicit Discourse Relations	LREC-COLING	We present DiscoGeM 2.0, a crowdsourced, parallel corpus of 12,834 implicit discourse relations, with English, German, French and Czech data. We propose and validate a new single-step crowdsourcing annotation method and apply it to collect new annotations in German, French and Czech. The corpus was constructed by having crowdsourced annotators choose a suitable discourse connective for each relation from a set of unambiguous candidates. Every instance was annotated by 10 workers. Our corpus hence represents the first multi-lingual resource that contains distributions of discourse interpretations for implicit relations. The results show that the connective insertion method of discourse annotation can be reliably extended to other languages. The resulting multi-lingual annotations also reveal that implicit relations inferred in one language may differ from those inferred in the translation, meaning the annotations are not always directly transferable. DiscoGem 2.0 promotes the investigation of cross-linguistic differences in discourse marking and could improve automatic discourse parsing applications. It is openly downloadable here: https://github.com/merelscholman/DiscoGeM.	Discogem-2.0-a-parallel-corpus-of-english	https://aclanthology.org/2024.lrec-main.443/	
2024-01-01	2024	Christina Pollkläsener, Frances Yung, Ekaterina Lapshinova-Koltunski	Christina Pollkläsener, Frances Yung, Ekaterina Lapshinova-Koltunski (Across Languages and Cultures 2024)	manuscripts	Capturing variation of discourse relations in English parallel data through automatic annotation and alignment	Across Languages and Cultures	We present a study of discourse connectives and discourse relations in English parallel texts, i.e. in written and spoken originals, as well as translation and interpreting from German. For this, we apply automatic procedures to annotate discourse connectives and relations they trigger in a parallel corpus. We look at distributions of various connectives and discourse relations, comparing spoken and written mode, as well as original and translated or interpreted language production. Furthermore, we analyse the translation patterns in terms of translation entropy. We link our observations to the phenomena of explicitation and implicitation. We find that in both interpreting and translation, explicitation and implicitation patters are affected by the cognitive complexity of the discourse relation signalled by the connective. Moreover, we also show that the difference in the specificity of the same connectives in interpreting and translation also depends on the type of relation they trigger.	Capturing-variation-of-discourse-relations	https://akjournals.com/view/journals/084/25/2/article-p288.xml	
2025-01-01	2025	Frances Yung, Vera Demberg	Frances Yung, Vera Demberg (CoMeDi Workshop @ Coling 2025)	conferences	On Crowdsoursing Discourse Relation Annotation	Workshop on Navigating Disagreement in NLP Annotation @ COLING		On-crowdsoursing-task-design	https://aclanthology.org/2025.comedi-1.2/	
2025-01-01	2025	Frances Yung, Varsha Suresh, Zaynab Reza, Mansoor Ahmad, Vera Demberg	Frances Yung, Varsha Suresh, Zaynab Reza, Mansoor Ahmad, Vera Demberg (SIGDIAL 2025)	conferences	Synthetic Data Augmentation for Cross-domain Implicit Discourse Relation Recognition 	SIGDIAL	Implicit discourse relation recognition (IDRR) -- the task of identifying the implicit coherence relation between two text spans -- requires deep semantic understanding. Recent studies have shown that zero- or few-shot approaches significantly lag behind supervised models, but LLMs may be useful for synthetic data augmentation, where LLMs generate a second argument following a specified coherence relation. We applied this approach in a cross-domain setting, generating discourse continuations using unlabelled target-domain data to adapt a base model which was trained on source-domain labelled data. Evaluations conducted on a large-scale test set revealed that different variations of the approach did not result in any significant improvements. We conclude that LLMs often fail to generate useful samples for IDRR, and emphasize the importance of considering both statistical significance and comparability when evaluating IDRR models.	Synthetic-data-augmentation	https://arxiv.org/abs/2503.20588	
2025-01-01	2025	Frances Yung, Vera Demberg	Frances Yung, Vera Demberg (UCCTS)	conferences	Meaning Shifts of Implicit Discourse Relations in Translation: a Multi-lingual Corpus Study	UCCTS		Meaning-Shifts-of-Implicit	https://www.uni-hildesheim.de/media/fb3/uebersetzungswissenschaft/UCCTS2025_BoA.pdf	
